Title,Author,Is Part Of,Dissertation,Edition,Publisher,Creation Date,Identifier,Format,Subjects,MESH subjects,Genre,Description,General note,With,Language,Attribution,Contents,Additional Title,Related Titles,Series,Frequency,Bound with,Source,MMS ID,Course Information,Permalink
A Leap among Quantum Computing and Quantum Neural Networks: A Survey,"Massoli, Fabio Valerio ;  Vadicamo, Lucia ;  Amato, Giuseppe ;  Falchi, Fabrizio","ACM computing surveys, 2022, Vol.55 (5), p.1-37, Article 98",,,"New York, NY: ACM",,ISSN: 0360-0300; EISSN: 1557-7341; DOI: 10.1145/3529756,,Algorithms ;  Applied computing ;  Computer systems organization ;  Computing methodologies ;  Hardware ;  Machine learning ;  Neural networks ;  Physics ;  Quantum computing ;  Quantum phenomena ;  Quantum technologies,,,"In recent years, Quantum Computing witnessed massive improvements in terms of available resources and algorithms development. The ability to harness quantum phenomena to solve computational problems is a long-standing dream that has drawn the scientific community’s interest since the late ’80s. In such a context, we propose our contribution. First, we introduce basic concepts related to quantum computations, and then we explain the core functionalities of technologies that implement the Gate Model and Adiabatic Quantum Computing paradigms. Finally, we gather, compare, and analyze the current state-of-the-art concerning Quantum Perceptrons and Quantum Neural Networks implementations.",,,English,,,,,,,,EBSCOhost Business Source Premier; ACM Digital Library,,,https://sussex.primo.exlibrisgroup.com/permalink/44SUS_INST/18j2vj2/cdi_proquest_journals_2817774878
Trapped-ion quantum computing: Progress and challenges,"Bruzewicz, Colin D. ;  Chiaverini, John ;  McConnell, Robert ;  Sage, Jeremy M.","Applied Physics Reviews, 2019, Vol.6 (2)",,,"Ithaca: Cornell University Library, arXiv.org",,ISSN: 1931-9401; EISSN: 1931-9401; EISSN: 2331-8422; DOI: 10.1063/1.5088164; CODEN: APRPG5,,Algorithms ;  Computation ;  Quantum computers ;  Quantum computing ;  Quantum theory ;  Qubits (quantum computing),,,"Trapped ions are among the most promising systems for practical quantum computing (QC). The basic requirements for universal QC have all been demonstrated with ions, and quantum algorithms using few-ion-qubit systems have been implemented. We review the state of the field, covering the basics of how trapped ions are used for QC and their strengths and limitations as qubits. In addition, we discuss what is being done, and what may be required, to increase the scale of trapped ion quantum computers while mitigating decoherence and control errors. Finally, we explore the outlook for trapped-ion QC. In particular, we discuss near-term applications, considerations impacting the design of future systems of trapped ions, and experiments and demonstrations that may further inform these considerations.",,,English,,,,,,,,AIP Journals; arXiv.org; Free E- Journals,,,https://sussex.primo.exlibrisgroup.com/permalink/44SUS_INST/18j2vj2/cdi_scitation_primary_10_1063_1_5088164
Practical Quantum Computing: solving the wave equation using a quantum approach,"Suau, Adrien ;  Staffelbach, Gabriel ;  Calandra, Henri","arXiv.org, 2021",,,"Ithaca: Cornell University Library, arXiv.org",,EISSN: 2331-8422; DOI: 10.1145/3430030,,Algorithms ;  Circuits ;  Error correction ;  Partial differential equations ;  Physics - Quantum Physics ;  Quantum computers ;  Quantum computing ;  Wave equations,,,"In the last years, several quantum algorithms that try to address the problem of partial differential equation solving have been devised. On one side, ""direct"" quantum algorithms that aim at encoding the solution of the PDE by executing one large quantum circuit. On the other side, variational algorithms that approximate the solution of the PDE by executing several small quantum circuits and making profit of classical optimisers. In this work we propose an experimental study of the costs (in terms of gate number and execution time on a idealised hardware created from realistic gate data) associated with one of the ""direct"" quantum algorithm: the wave equation solver devised in [PCS. Costa, S. Jordan, A. Ostrander, Phys. Rev. A 99, 012323, 2019]. We show that our implementation of the quantum wave equation solver agrees with the theoretical big-O complexity of the algorithm. We also explain in great details the implementation steps and discuss some possibilities of improvements. Finally, our implementation proves experimentally that some PDE can be solved on a quantum computer, even if the direct quantum algorithm chosen will require error-corrected quantum chips, which are not believed to be available in the short-term.",,,English,,,,,,,,arXiv.org; Free E- Journals,,,https://sussex.primo.exlibrisgroup.com/permalink/44SUS_INST/18j2vj2/cdi_arxiv_primary_2003_12458
Challenges in the Use of Quantum Computing Hardware-Efficient Ansätze in Electronic Structure Theory,"D’Cunha, Ruhee ;  Crawford, T. Daniel ;  Motta, Mario ;  Rice, Julia E.","The journal of physical chemistry. A, Molecules, spectroscopy, kinetics, environment, & general theory, 2023, Vol.127 (15), p.3437-3448",,,American Chemical Society,,ISSN: 1089-5639; EISSN: 1520-5215; DOI: 10.1021/acs.jpca.2c08430,,A: New Tools and Methods in Experiment and Theory,,,"Advances in quantum computation for electronic structure, and particularly heuristic quantum algorithms, create an ongoing need to characterize the performance and limitations of these methods. Here we discuss some potential pitfalls connected with the use of hardware-efficient Ansätze in variational quantum simulations of electronic structure. We illustrate that hardware-efficient Ansätze may break Hamiltonian symmetries and yield nondifferentiable potential energy curves, in addition to the well-known difficulty of optimizing variational parameters. We discuss the interplay between these limitations by carrying out a comparative analysis of hardware-efficient Ansätze versus unitary coupled cluster and full configuration interaction, and of second- and first-quantization strategies to encode Fermionic degrees of freedom to qubits. Our analysis should be useful in understanding potential limitations and in identifying possible areas of improvement in hardware-efficient Ansätze.",,,English,,,,,,,,Nesli2 American Chemical Society; American Chemical Society Journals,,,https://sussex.primo.exlibrisgroup.com/permalink/44SUS_INST/18j2vj2/cdi_acs_journals_10_1021_acs_jpca_2c08430
Empowering an IoT platform with  advance quantum computing and a Customized deep residual technique,"Ashok, P. ;  Ragunthar, T. ;  James, T. Prabahar Godwin ;  Sahayaraj, K. Kishore Anthuvan ;  Suganthi, P. ;  Somasundaram, K. ;  Ananthi, S.","Optical and quantum electronics, 2023, Vol.55 (10), Article 859",,,New York: Springer US,,ISSN: 0306-8919; EISSN: 1572-817X; DOI: 10.1007/s11082-023-05154-4,,Accuracy ;  Characterization and Evaluation of Materials ;  Computer Communication Networks ;  Cost function ;  Data analysis ;  Data collection ;  Data exchange ;  Datasets ;  Decision analysis ;  Decision making ;  Electrical Engineering ;  Internet of Things ;  Lasers ;  Neural networks ;  Optical Devices ;  Optics ;  Photonics ;  Physics ;  Physics and Astronomy ;  Quantum computing,,,"All over the world, millions of devices are wirelessly connected and exchanging data as part of the Internet of Things (IoT). As more and more information is hoped to be monitored by means of a single platform, the importance of accuracy assessment in the pursuit of the perfect IoT platform has grown. To keep up with the ever-increasing data analysis needs for crucial, real-time decision making, IoT data collection is becoming increasingly crucial. In this study, we utilized the ""IoT Sensor Data"" dataset, consisting of sensor readings collected from various IoT devices. The proposed R-QCNN model, which combines a quantum neural network with a deep residual learning technique, was trained and evaluated on this dataset. Experimental results show that the R-QCNN achieved an accuracy of 95% in classifying the IoT sensor data, outperforming existing methods. Thus, our approach demonstrates promising results in optimizing the cost function routine for IoT platforms.",,,English,,,,,,,,SpringerLINK Contemporary 1997-Present; KB+ JISC Collections Springer Compact 2019-2021; SpringerLink Journals - AutoHoldings; Springer Journals Online,,,https://sussex.primo.exlibrisgroup.com/permalink/44SUS_INST/18j2vj2/cdi_proquest_journals_2839384480
Quantum computing explained ,"McMahon, David (David M.) author. ",,,,"Hoboken, NJ : Wiley-Interscience ",2008,OCLC : (OCoLC)608622533,"1 online resource (xviii, 332 pages) : illustrations",Quantum computers; Computers,,,,,,English,David McMahon.,,,,,,,Library Catalog,99716522402461,,https://sussex.primo.exlibrisgroup.com/permalink/44SUS_INST/q9fqsr/alma99716522402461
Exploring Parameter Redundancy in the Unitary Coupled-Cluster Ansätze for Hybrid Variational Quantum Computing,"Mehendale, Shashank G. ;  Peng, Bo ;  Govind, Niranjan ;  Alexeev, Yuri","The journal of physical chemistry. A, Molecules, spectroscopy, kinetics, environment, & general theory, 2023, Vol.127 (20)",,,United States: American Chemical Society,,ISSN: 1089-5639; EISSN: 1520-5215; DOI: 10.1021/acs.jpca.3c00550,,"Energy ;  Entropy ;  INORGANIC, ORGANIC, PHYSICAL, AND ANALYTICAL CHEMISTRY ;  Mathematical methods ;  Molecules ;  Quantum mechanics",,,"One of the commonly used chemical-inspired approaches in variational quantum computing is the unitary coupled-cluster (UCC) ansatze. Despite being a systematic way of approaching the exact limit, the number of parameters in the standard UCC ansatze exhibits unfavorable scaling with respect to the system size, hindering its practical use on near-term quantum devices. Efforts have been taken to propose some variants of UCC ansatze with better scaling. In this paper we explore the parameter redundancy in the preparation of unitary coupled-cluster singles and doubles (UCCSD) ansatze employing spin-adapted formulation, small amplitude filtration, and entropy-based orbital selection approaches. Numerical results of using our approach on some small molecules have exhibited a significant cost reduction in the number of parameters to be optimized and in the time to convergence compared with conventional UCCSD-VQE simulations. Further, we also discuss the potential application of some machine learning techniques in further exploring the parameter redundancy, providing a possible direction for future studies.",,,English,,,,,,,,Nesli2 American Chemical Society; American Chemical Society Journals,,,https://sussex.primo.exlibrisgroup.com/permalink/44SUS_INST/18j2vj2/cdi_osti_scitechconnect_2203855
Control and Readout Software for Superconducting Quantum Computing,"Guo, Cheng ;  Liang, Futian ;  Lin, Jin ;  Xu, Yu ;  Sun, Lihua ;  Liu, Weiyue ;  Liao, Shengkai ;  Peng, Chengzhi","IEEE transactions on nuclear science, 2019, Vol.66 (7), p.1222-1227",,,Ithaca: IEEE,,ISSN: 0018-9499; ISSN: 1558-1578; EISSN: 1558-1578; EISSN: 2331-8422; DOI: 10.1109/TNS.2019.2920337; CODEN: IETNAE,,Analog to digital conversion ;  Analog to digital converters ;  Arbitrary waveform generator (AWG) ;  Communication ;  Control equipment ;  Data transmission ;  Digital computers ;  Digital to analog conversion ;  Digital to analog converters ;  Digitization ;  digitizer ;  Distortion ;  Hardware ;  Innovations ;  Instruments ;  Low speed ;  Optimization ;  Quantum computers ;  Quantum computing ;  Qubit ;  Qubits (quantum computing) ;  Servers ;  Software ;  Superconductivity ;  Waveform generators,,,"Being important parts of the superconducting quantum computer, the high-speed arbitrary waveform generator (AWG), ultraprecision dc source, and high-speed digitizer are used to manipulate the qubit. The complexity of an experimental setup increases rapidly as the number of qubits grows. Cumbersome instrument management, distortion of signals, and inefficiency of data transmission are gradually highlighted and become the bottlenecks in scaling up the number of qubits. In addition, fault-tolerant quantum computing has real-time feedback requirements of qubit states. To deal with these challenges, we propose an instrument management software design in this paper. The software maps the resources of separate instruments to a unified virtual instrument, achieving the scalability of the instruments. The processing and correction of signals are deployed on a server, which automatically corrects the distortion of the signals. By designing a multi-threaded mechanism for the AWG and a custom-defined data-link protocol for the digitizer, the efficiency of the software meets the requirements of experiments. Cooperating with the AWG and digitizer, the software provides the real-time feedback capability using an instruction compiler. Thus, the software meets the requirements of superconducting quantum computing, as demonstrated through its application to a 12-bit quantum experiment.",,,English,,,,,,,,IEEE Xplore All Journals; IEEE Electronic Library (IEL) Journals; arXiv.org; Free E- Journals,,,https://sussex.primo.exlibrisgroup.com/permalink/44SUS_INST/18j2vj2/cdi_arxiv_primary_1806_04021
Strong Quantum Computational Advantage Using a Superconducting Quantum Processor,"Wu, Yulin ;  Bao, Wan-Su ;  Cao, Sirui ;  Chen, Fusheng ;  Chen, Ming-Cheng ;  Chen, Xiawei ;  Chung, Tung-Hsun ;  Deng, Hui ;  Du, Yajie ;  Fan, Daojin ;  Gong, Ming ;  Guo, Cheng ;  Guo, Chu ;  Guo, Shaojun ;  Han, Lianchen ;  Hong, Linyin ;  Huang, He-Liang ;  Huo, Yong-Heng ;  Li, Liping ;  Li, Na ;  Li, Shaowei ;  Li, Yuan ;  Liang, Futian ;  Lin, Chun ;  Lin, Jin ;  Qian, Haoran ;  Qiao, Dan ;  Rong, Hao ;  Su, Hong ;  Sun, Lihua ;  Wang, Liangyuan ;  Wang, Shiyu ;  Wu, Dachao ;  Xu, Yu ;  Yan, Kai ;  Yang, Weifeng ;  Yang, Yang ;  Ye, Yangsen ;  Yin, Jianghan ;  Ying, Chong ;  Yu, Jiale ;  Zha, Chen ;  Zhang, Cha ;  Zhang, Haibin ;  Zhang, Kaili ;  Zhang, Yiming ;  Zhao, Han ;  Zhao, Youwei ;  Zhou, Liang ;  Zhu, Qingling ;  Lu, Chao-Yang ;  Peng, Cheng-Zhi ;  Zhu, Xiaobo ;  Pan, Jian-Wei","Physical review letters, 2021, Vol.127 (18), p.180501-180501, Article 180501",,,"Ithaca: Cornell University Library, arXiv.org",,ISSN: 0031-9007; ISSN: 1092-0145; ISSN: 1079-7114; EISSN: 1079-7114; EISSN: 2331-8422; DOI: 10.1103/PhysRevLett.127.180501,,Algorithms ;  Computing costs ;  Microprocessors ;  Physics - Quantum Physics ;  Quantum computing ;  Qubits (quantum computing) ;  Sampling ;  Superconductivity,,,"Scaling up to a large number of qubits with high-precision control is essential in the demonstrations of quantum computational advantage to exponentially outpace the classical hardware and algorithmic improvements. Here, we develop a two-dimensional programmable superconducting quantum processor, \textit{Zuchongzhi}, which is composed of 66 functional qubits in a tunable coupling architecture. To characterize the performance of the whole system, we perform random quantum circuits sampling for benchmarking, up to a system size of 56 qubits and 20 cycles. The computational cost of the classical simulation of this task is estimated to be 2-3 orders of magnitude higher than the previous work on 53-qubit Sycamore processor [Nature \textbf{574}, 505 (2019)]. We estimate that the sampling task finished by \textit{Zuchongzhi} in about 1.2 hours will take the most powerful supercomputer at least 8 years. Our work establishes an unambiguous quantum computational advantage that is infeasible for classical computation in a reasonable amount of time. The high-precision and programmable quantum computing platform opens a new door to explore novel many-body phenomena and implement complex quantum algorithms.",,,English,,,,,,,,American Physical Society Journals; arXiv.org; Free E- Journals,,,https://sussex.primo.exlibrisgroup.com/permalink/44SUS_INST/18j2vj2/cdi_unpaywall_primary_10_1103_physrevlett_127_180501
"An Enhanced Architecture to Resolve Public-Key Cryptographic Issues in the Internet of Things (IoT), Employing Quantum Computing Supremacy","Shamshad, Shuhab ;  Riaz, Farina ;  Riaz, Rabia ;  Rizvi, Sanam Shahla ;  Abdulla, Shahab","Sensors (Basel, Switzerland), 2022, Vol.22 (21), p.8151",,,Basel: MDPI AG,,ISSN: 1424-8220; EISSN: 1424-8220; DOI: 10.3390/s22218151; PMID: 36365848,,Algorithms ;  Analysis ;  Communication ;  Computer architecture ;  Computers ;  Convergence ;  Cryptography ;  Data integrity ;  Digital signatures ;  Eavesdropping ;  Global economy ;  Information processing ;  Internet ;  Internet of Things ;  Internet of Things (IoT) ;  public-key cryptography ;  quantum communication ;  Quantum computing ;  quantum computing supremacy ;  Quantum cryptography ;  Quantum physics ;  Quantum theory,,,"The Internet of Things (IoT) strongly influences the world economy; this emphasizes the importance of securing all four aspects of the IoT model: sensors, networks, cloud, and applications. Considering the significant value of public-key cryptography threats on IoT system confidentiality, it is vital to secure it. One of the potential candidates to assist in securing public key cryptography in IoT is quantum computing. Although the notion of IoT and quantum computing convergence is not new, it has been referenced in various works of literature and covered by many scholars. Quantum computing eliminates most of the challenges in IoT. This research provides a comprehensive introduction to the Internet of Things and quantum computing before moving on to public-key cryptography difficulties that may be encountered across the convergence of quantum computing and IoT. An enhanced architecture is then proposed for resolving these public-key cryptography challenges using SimuloQron to implement the BB84 protocol for quantum key distribution (QKD) and one-time pad (OTP). The proposed model prevents eavesdroppers from performing destructive operations in the communication channel and cyber side by preserving its state and protecting the public key using quantum cryptography and the BB84 protocol. A modified version is introduced for this IoT situation. A traditional cryptographic mechanism called “one-time pad” (OTP) is employed in hybrid management.",,,English,,,,,,,,DOAJ Directory of Open Access Journals; Scholars Portal Journals: Open Access; GFMER Free Medical Journals,,,https://sussex.primo.exlibrisgroup.com/permalink/44SUS_INST/18j2vj2/cdi_doaj_primary_oai_doaj_org_article_96bc02d045e54950a5e99d685533651f
Experimental realization of quantum algorithms for linear system inspired by adiabatic quantum computing,"Wen, Jingwei ;  Kong, Xiangyu ;  Wei, Shijie ;  Wang, Bixue ;  Tao Xin ;  Long, Guilu","arXiv.org, 2019",,,"Ithaca: Cornell University Library, arXiv.org",,EISSN: 2331-8422; DOI: 10.1103/PhysRevA.99.012320,,Adiabatic flow ;  Algorithms ;  Computation ;  Linear equations ;  NMR ;  Nuclear magnetic resonance ;  Physics - Quantum Physics ;  Quantum computing ;  Qubits (quantum computing),,,"Quantum adiabatic algorithm is of vital importance in quantum computation field. It offers us an alternative approach to manipulate the system instead of quantum gate model. Recently, an interesting work arXiv:1805.10549 indicated that we can solve linear equation system via algorithm inspired by adiabatic quantum computing. Here we demonstrate the algorithm and realize the solution of 8-dimensional linear equations \(A\textbf{x}=\textbf{b}\) in a 4-qubit nuclear magnetic resonance system. The result is by far the solution of maximum-dimensional linear equation with a limited number of qubits in experiments, which includes some ingenious simplifications. Our experiment provides the new possibility of solving so many practical problems related to linear equations systems and has the potential applications in designing the future quantum algorithms.",,,English,,,,,,,,arXiv.org; Free E- Journals,,,https://sussex.primo.exlibrisgroup.com/permalink/44SUS_INST/18j2vj2/cdi_arxiv_primary_1806_03295
The Hong–Ou–Mandel experiment: from photon indistinguishability to continuous-variable quantum computing,"Fabre, N. ;  Amanti, M. ;  Baboux, F. ;  Keller, A. ;  Ducci, S. ;  Milman, P.","The European physical journal. D, Atomic, molecular, and optical physics, 2022, Vol.76 (10), Article 196",,,Berlin/Heidelberg: Springer Berlin Heidelberg,,ISSN: 1434-6060; EISSN: 1434-6079; DOI: 10.1140/epjd/s10053-022-00525-0,,Applications of Nonlinear Dynamics and Chaos Theory ;  Atomic ;  Continuity (mathematics) ;  Degrees of freedom ;  Electromagnetic fields ;  Error correction ;  Experiments ;  Interferometers ;  Logic circuits ;  Molecular ;  Optical and Plasma Physics ;  Photons ;  Physical Chemistry ;  Physics ;  Physics and Astronomy ;  Quadratures ;  Quantum computing ;  Quantum Information Technology ;  Quantum optics ;  Quantum Optics of Light and Matter Honouring Alain Aspect ;  Quantum phenomena ;  Quantum Physics ;  Regular Article – Quantum Optics ;  Spectroscopy/Spectrometry ;  Spintronics ;  Time measurement ;  Variables ;  Waveguides,,,"We extensively discuss the Hong–Ou–Mandel experiment by taking an original phase-space-based perspective. For this, we analyze time and frequency variables as quantum continuous variables in perfect analogy with position and momentum of massive particles or with the electromagnetic field’s quadratures. We discuss how this experiment can be used to directly measure the time-frequency Wigner function and implement logical gates in these variables. We also briefly discuss the quantum/classical aspects of this experiment providing a general expression for intensity correlations that make explicit the differences between a classical Hong–Ou–Mandel-like dip and a quantum one. Throughout the manuscript, we will often focus and refer to a particular system based on AlGaAs waveguides emitting photon pairs via spontaneous parametric down conversion, but our results can be extended to other analogous experimental systems and to various degrees of freedom.
Graphical Abstract
The Hong–Ou–Mandel experiment is a landmark in quantum optics, showing the bunching of indistinguishable bunch. In the present contribution, we give another perspective to this experiment based on a phase space representation of the continuous degrees of freedom of the single photons sent into the input arms of such interferometer. We show that the coincidence detection in the output ports of an Hong– Ou–Mandel interferometer is a direct measurement of the Wigner function of the produced photons in a given region of space, and we discuss how continuous degrees of freedom of single photons can be used in continuous variables quantum protocols, as quantum error correction and metrology. Our results open the perspective of broadening even more the applications of single photon-based quantum information-related protocols.",,,English,,,,,,,,SpringerLINK Contemporary 1997-Present; KB+ JISC Collections Springer Compact 2019-2021; SpringerLink Journals - AutoHoldings; Springer Journals Online,,,https://sussex.primo.exlibrisgroup.com/permalink/44SUS_INST/18j2vj2/cdi_hal_primary_oai_HAL_hal_03701087v1
Designing nanotechnology QCA–multiplexer using majority function-based NAND for quantum computing,"Jeon, Jun-Cheol","The Journal of supercomputing, 2021, Vol.77 (2), p.1562-1578",,,New York: Springer US,,ISSN: 0920-8542; EISSN: 1573-0484; DOI: 10.1007/s11227-020-03341-8,,Arithmetic ;  Automata theory ;  Cellular automata ;  Circuit design ;  CMOS ;  Compilers ;  Computer Science ;  Energy consumption ;  Energy dissipation ;  Gates (circuits) ;  Interpreters ;  Logic circuits ;  Multiplexers ;  Multiplexing ;  Nanotechnology ;  Processor Architectures ;  Programming Languages ;  Quantum computing ;  Quantum dots ;  Soft Computing Technology in Artificial Intelligence,,,"Quantum-dot cellular automata (QCAs) are one of the most significant state-of-the-art technologies that have exhibited the potential to replace the complementary metal oxide semiconductor. QCA offers a variety of benefits over its conventional counterpart, including size, latency, and energy consumption. Meanwhile, multiplexers are crucial to the design of arithmetic and logic circuits, and NOT-AND (NAND) gates are universal gates that allow the design of any circuit. In this paper, we propose a new multiplexer based on three NAND gates in QCA. De Morgan's law is used to derive new equations and to design multiplexers using only NAND logics. The proposed circuit is designed and verified not only to minimize time and space complexity but also to minimize energy loss. Finally, we design an arithmetic circuit that is capable of performing various operations using the proposed multiplexer.",,,English,,,,,,,,SpringerLINK Contemporary 1997-Present; KB+ JISC Collections Springer Compact 2019-2021; SpringerLink Journals - AutoHoldings; Springer Journals Online,,,https://sussex.primo.exlibrisgroup.com/permalink/44SUS_INST/18j2vj2/cdi_proquest_journals_2480787356
Quantum computing: powered by magic,"Bartlett, Stephen D","Nature (London), 2014, Vol.510 (7505), p.345-347",,,England,,EISSN: 1476-4687; DOI: 10.1038/nature13504; PMID: 24919151,,,,,,,,English,,,,,,,,Nature journals; Nature; Alma/SFX Local Collection,,,https://sussex.primo.exlibrisgroup.com/permalink/44SUS_INST/18j2vj2/cdi_proquest_miscellaneous_1539465290
